{
  "id": "qwen-3.8-27b-iq3s-mtp",
  "displayName": "Qwen 3.8 27B IQ3_S + MTP",
  "description": "Qwen 3.8 27B dense, Unsloth UD-IQ3_S GGUF, optimizado para una NVIDIA RTX 5060 Ti 16 GB: CUDA con offload completo de GPU, Flash Attention, caché KV Q4_0 y MTP especulativo integrado. Solo texto (no se declara mmproj).",
  "runtime": {
    "adapter": "llama-cpp",
    "repository": "https://github.com/ggml-org/llama.cpp.git",
    "revision": "620d2225cc436ab0b001e3200e590e3b286ef9ab",
    "cmakeArgs": [
      "-DGGML_CUDA=ON",
      "-DGGML_NATIVE=OFF",
      "-DBUILD_SHARED_LIBS=OFF",
      "-DCMAKE_CUDA_ARCHITECTURES=120"
    ]
  },
  "model": {
    "repository": "unsloth/Qwen3.8-27B-GGUF",
    "file": "Qwen3.8-27B-UD-IQ3_S.gguf",
    "revision": "4ca720788d1e01f1bff70c033e0d0028fd02e502",
    "sha256": "d847e2c1e4aa276e4b7b8e9ad7628050e61e165d49ab995407bc36677a6f3864"
  },
  "server": {
    "contextSize": 32768,
    "parallel": 1,
    "arguments": [
      "-ngl",
      "99",
      "-fa",
      "on",
      "-ctk",
      "q4_0",
      "-ctv",
      "q4_0",
      "--spec-type",
      "draft-mtp",
      "--spec-draft-n-max",
      "3",
      "--jinja",
      "--temp",
      "0.6",
      "--top-p",
      "0.95",
      "--top-k",
      "20",
      "--min-p",
      "0",
      "--presence-penalty",
      "1.0",
      "--reasoning-budget",
      "4096",
      "--reasoning-budget-message",
      "Enough thinking. I will act now with the information I have."
    ]
  },
  "chatTemplate": {
    "thinkingToggleKwarg": "enable_thinking"
  },
  "requirements": {
    "minimumVramGiB": 16,
    "recommendedVramGiB": 16
  },
  "capabilities": {
    "chatCompletions": true,
    "responses": true,
    "toolCalling": true,
    "reasoning": true,
    "vision": false,
    "audio": false
  },
  "status": "experimental"
}