{
  "id": "gemma-4-26b-a4b-iq4xs-mtp",
  "displayName": "Gemma 4 26B-A4B IT IQ4_XS with MTP",
  "description": "Variante de cuantización IQ4_XS de Gemma 4 26B-A4B (unsloth/gemma-4-26B-A4B-it-GGUF); solo texto, para comparar contra la variante QAT.",
  "runtime": {
    "adapter": "llama-cpp",
    "repository": "https://github.com/ggml-org/llama.cpp.git",
    "revision": "ff5a23376725e5a889fa0bfb987b7541dc304da0",
    "cmakeArgs": [
      "-DGGML_CUDA=ON",
      "-DGGML_NATIVE=OFF",
      "-DBUILD_SHARED_LIBS=OFF",
      "-DCMAKE_CUDA_ARCHITECTURES=120"
    ]
  },
  "model": {
    "repository": "unsloth/gemma-4-26B-A4B-it-GGUF",
    "file": "gemma-4-26B-A4B-it-UD-IQ4_XS.gguf",
    "revision": "c099eb48e663fd284577b04978a94ffccb261841",
    "sha256": "babd1e389d386352f71600765d37390f7dc993fbfad6725caccf996ffe34aecf"
  },
  "draftModel": {
    "repository": "unsloth/gemma-4-26B-A4B-it-GGUF",
    "file": "mtp-gemma-4-26B-A4B-it.gguf",
    "revision": "c099eb48e663fd284577b04978a94ffccb261841",
    "sha256": "6326fb9f5e487aa8dcdd313a091e3c67724cb2a666ec3b7d2895b5b26d93ed1b"
  },
  "server": {
    "contextSize": 32768,
    "parallel": 1,
    "arguments": [
      "--n-gpu-layers",
      "99",
      "--ubatch-size",
      "256",
      "--flash-attn",
      "on",
      "--cache-type-k",
      "q8_0",
      "--cache-type-v",
      "q8_0",
      "--jinja",
      "--spec-type",
      "draft-mtp",
      "--spec-draft-n-max",
      "2",
      "--temp",
      "1.0",
      "--top-p",
      "0.95",
      "--top-k",
      "64",
      "--reasoning-budget",
      "4096",
      "--reasoning-budget-message",
      "Enough thinking. I will act now with the information I have."
    ]
  },
  "chatTemplate": {
    "thinkingToggleKwarg": "enable_thinking",
    "file": "gemma-4-ordered-args.jinja"
  },
  "requirements": {
    "minimumVramGiB": 16,
    "recommendedVramGiB": 16
  },
  "capabilities": {
    "chatCompletions": true,
    "responses": "verify",
    "toolCalling": "verify",
    "reasoning": true,
    "vision": false,
    "audio": false
  },
  "status": "experimental"
}
