{
  "id": "qwen-3.6-moe-2bit",
  "displayName": "Qwen 3.6 35B-A3B MoE 2-bit with MTP",
  "description": "Perfil Qwen de alta capacidad ajustado a una GPU de 16 GB.",
  "runtime": {
    "adapter": "llama-cpp",
    "repository": "https://github.com/ggml-org/llama.cpp.git",
    "revision": "ff5a23376725e5a889fa0bfb987b7541dc304da0",
    "cmakeArgs": ["-DGGML_CUDA=ON", "-DGGML_NATIVE=OFF", "-DBUILD_SHARED_LIBS=OFF", "-DCMAKE_CUDA_ARCHITECTURES=120"]
  },
  "model": {
    "repository": "havenoammo/Qwen3.6-35B-A3B-MTP-GGUF",
    "file": "Qwen3.6-35B-A3B-MTP-UD-Q2_K_XL.gguf",
    "revision": "44ce525026e7e7d0e0915dc1bf83a783c813e75a",
    "sha256": null
  },
  "server": {
    "contextSize": 32768,
    "parallel": 1,
    "arguments": ["--n-gpu-layers", "99", "--flash-attn", "on", "--cache-type-k", "q4_0", "--cache-type-v", "q4_0", "--load-mode", "mmap", "--jinja", "--spec-type", "draft-mtp", "--spec-draft-n-max", "4", "--temp", "0.6", "--top-p", "0.95", "--top-k", "20", "--min-p", "0", "--presence-penalty", "1.0", "--reasoning-budget", "4096", "--reasoning-budget-message", "Enough thinking. I will act now with the information I have."]
  },
  "chatTemplate": {"thinkingToggleKwarg": "enable_thinking"},
  "requirements": {"minimumVramGiB": 15, "recommendedVramGiB": 16},
  "capabilities": {"chatCompletions": true, "responses": "verify", "toolCalling": true, "reasoning": true, "vision": false, "audio": false},
  "status": "experimental"
}
