{
  "id": "gemma-4-e2b-qat-q4kxl-mtp",
  "displayName": "Gemma 4 E2B IT QAT Q4_K_XL with MTP",
  "description": "Variante de cuantización Q4_K_XL de Gemma 4 E2B (unsloth/gemma-4-E2B-it-qat-GGUF); solo texto, para comparar contra la variante QAT.",
  "runtime": {
    "adapter": "llama-cpp",
    "repository": "https://github.com/ggml-org/llama.cpp.git",
    "revision": "620d2225cc436ab0b001e3200e590e3b286ef9ab",
    "cmakeArgs": [
      "-DGGML_CUDA=ON",
      "-DGGML_NATIVE=OFF",
      "-DBUILD_SHARED_LIBS=OFF",
      "-DCMAKE_CUDA_ARCHITECTURES=120"
    ]
  },
  "model": {
    "repository": "unsloth/gemma-4-E2B-it-qat-GGUF",
    "file": "gemma-4-E2B-it-qat-UD-Q4_K_XL.gguf",
    "revision": "66a399f68ddd113b06dff02fca9523e55465d11d",
    "sha256": "e531007218dfab990486a5de7676a6932d6ea8dea233d1f698d7c21cf8a16889"
  },
  "draftModel": {
    "repository": "unsloth/gemma-4-E2B-it-qat-GGUF",
    "file": "mtp-gemma-4-E2B-it.gguf",
    "revision": "66a399f68ddd113b06dff02fca9523e55465d11d",
    "sha256": "586f2460b909008640981ec34060aa864e03c144fbabfb3173c4335087e4aae0"
  },
  "server": {
    "contextSize": 32768,
    "parallel": 1,
    "arguments": [
      "--n-gpu-layers",
      "99",
      "--flash-attn",
      "on",
      "--cache-type-k",
      "q8_0",
      "--cache-type-v",
      "q8_0",
      "--jinja",
      "--ubatch-size",
      "2048",
      "--spec-type",
      "draft-mtp",
      "--spec-draft-n-max",
      "2",
      "--temp",
      "1.0",
      "--top-p",
      "0.95",
      "--top-k",
      "64",
      "--reasoning-budget",
      "4096",
      "--reasoning-budget-message",
      "Enough thinking. I will act now with the information I have."
    ]
  },
  "chatTemplate": {
    "thinkingToggleKwarg": "enable_thinking"
  },
  "requirements": {
    "minimumVramGiB": 8,
    "recommendedVramGiB": 8
  },
  "capabilities": {
    "chatCompletions": true,
    "responses": "verify",
    "toolCalling": "verify",
    "reasoning": true,
    "vision": false,
    "audio": false
  },
  "status": "experimental"
}
