{
  "id": "gemma-4-26b-a4b-qat-mtp",
  "displayName": "Gemma 4 26B-A4B IT QAT with MTP",
  "description": "Gemma 4 26B-A4B MoE con QAT, Unsloth UD-Q4_K_XL (13,3 GiB) y drafter MTP; reemplaza al Q3_K_M no QAT, que cometía demasiados errores de herramienta. Ajustado para 16 GiB con el escritorio fuera de la GPU.",
  "runtime": {
    "adapter": "llama-cpp",
    "repository": "https://github.com/ggml-org/llama.cpp.git",
    "revision": "620d2225cc436ab0b001e3200e590e3b286ef9ab",
    "cmakeArgs": [
      "-DGGML_CUDA=ON",
      "-DGGML_NATIVE=OFF",
      "-DBUILD_SHARED_LIBS=OFF",
      "-DCMAKE_CUDA_ARCHITECTURES=120"
    ]
  },
  "model": {
    "repository": "unsloth/gemma-4-26B-A4B-it-qat-GGUF",
    "file": "gemma-4-26B-A4B-it-qat-UD-Q4_K_XL.gguf",
    "revision": "7b92b5b28818151e8669af2e45e88d6086f490dd",
    "sha256": "a7c5bc715f5ff8e99a3e8901ce7d2b42b402c669bf24f7c5250747633d0f5891"
  },
  "draftModel": {
    "repository": "unsloth/gemma-4-26B-A4B-it-qat-GGUF",
    "file": "mtp-gemma-4-26B-A4B-it.gguf",
    "revision": "7b92b5b28818151e8669af2e45e88d6086f490dd",
    "sha256": "7272d97595f0d4c74bd7b623492b7dbdaafd8b7c72f329a8270ba4eca68f768a"
  },
  "server": {
    "contextSize": 32768,
    "parallel": 1,
    "arguments": [
      "--n-gpu-layers",
      "99",
      "--ubatch-size",
      "256",
      "--flash-attn",
      "on",
      "--cache-type-k",
      "q8_0",
      "--cache-type-v",
      "q8_0",
      "--jinja",
      "--spec-type",
      "draft-mtp",
      "--spec-draft-n-max",
      "2",
      "--temp",
      "1.0",
      "--top-p",
      "0.95",
      "--top-k",
      "64",
      "--reasoning-budget",
      "4096",
      "--reasoning-budget-message",
      "Enough thinking. I will act now with the information I have."
    ]
  },
  "chatTemplate": {
    "thinkingToggleKwarg": "enable_thinking",
    "file": "gemma-4-ordered-args.jinja"
  },
  "requirements": {
    "minimumVramGiB": 16,
    "recommendedVramGiB": 16
  },
  "capabilities": {
    "chatCompletions": true,
    "responses": "verify",
    "toolCalling": "verify",
    "reasoning": true,
    "vision": false,
    "audio": false
  },
  "status": "experimental"
}
